{"digest":{"algorithm":"sha256","canonicalizer":"triad_origin.canonical.canonical_json","domain":"triad.closure.status.artifact.v1","preimage_rule":"canonical_json({domain,schema,version,payload})","value":"723cedf14c2347adbbddb9a517054780190fe9d20ee73ac77a938f892acb671e"},"payload":{"activation_posture":{"paper_activation":"OFF","shadow_activation":"LIVE","venue_activation":"OFF","venue_environment":"OFF"},"classification":"GENERATED_STATUS_NON_EVIDENCE","closed_claims":[],"cryptographic_authentication":"NOT_CLAIMED","current_work":["CONTROL_FREEZE::C0::sha256:3a2152de236540099955b21e9efef846775d1aee0d15af86eafabecb954cc230","ORIGIN_REPAIR::B00R_G2::sha256:71b011d46c6a7ebd092bda6d2d303572c9a44508bd126ff9a50e2e5bad40eaf5"],"generation_law":"Derived from canonical semantics, exact task bindings, and append-only chained status events; manual edits are forbidden.","milestones":[{"blocking_reasons":["C0-CURRENT-LEDGER-REVIEW","C0-EXACT-HEAD-REVIEW","C0-OWNER-AUTH","C0-TARGET-ALLOCATION-REVIEW","LEGACY_B00_REALLOCATION_REQUIRED","REVIEW-SLOT::C0::C0_OWNER_AUTHENTICATOR","REVIEW-SLOT::C0::SOURCE_REVIEWER"],"gate_state":"BLOCKED","identity":"CONTROL_FREEZE::C0::sha256:3a2152de236540099955b21e9efef846775d1aee0d15af86eafabecb954cc230","receipt_state":"NOT_APPLICABLE","runtime_state":"NOT_APPLICABLE","work_state":"SOURCE_IN_PROGRESS"},{"blocking_reasons":["ANCHOR::B00R_G2","B00R-G2-AUTHORITY-PINS","B00R-G2-CANARY","B00R-G2-EXACT-HEAD-REVIEW","B00R-G2-RECEIPT-ANCHOR","B00R-G2-RULESET","PREDECESSOR::B00R_G2","RECEIPT::B00R_G2","REVIEW-SLOT::B00R_G2::RECEIPT_REVIEWER","REVIEW-SLOT::B00R_G2::SOURCE_REVIEWER"],"gate_state":"BLOCKED","identity":"ORIGIN_REPAIR::B00R_G2::sha256:71b011d46c6a7ebd092bda6d2d303572c9a44508bd126ff9a50e2e5bad40eaf5","receipt_state":"BLOCKED","runtime_state":"NOT_APPLICABLE","work_state":"SOURCE_IN_PROGRESS"},{"blocking_reasons":["ANCHOR::B01C","PREDECESSOR::B01C","RECEIPT::B01C","REVIEW-SLOT::B01C::RECEIPT_REVIEWER","REVIEW-SLOT::B01C::SOURCE_REVIEWER"],"gate_state":"BLOCKED","identity":"ORIGIN_REPAIR::B01C::sha256:7d6e36d32db8e3eee19aa6fd446bdc48644f70916ef09d939f113f19c5a6db5e","receipt_state":"BLOCKED","runtime_state":"NOT_APPLICABLE","work_state":"NOT_STARTED"},{"blocking_reasons":["ANCHOR::B02C","B02C-E01-OWNER-RECEIPT","PREDECESSOR::B02C","RECEIPT::B02C","REVIEW-SLOT::B02C::RECEIPT_REVIEWER","REVIEW-SLOT::B02C::SOURCE_REVIEWER","RUNTIME::B02C"],"gate_state":"BLOCKED","identity":"ORIGIN_REPAIR::B02C::sha256:c7362e128a8d249ad1075769a314baacd5d7993a62e2b374ed22ea8eb7b3e5bf","receipt_state":"BLOCKED","runtime_state":"NOT_ATTESTED","work_state":"NOT_STARTED"},{"blocking_reasons":["ANCHOR::B03C","B03C-E01-OWNER-RECEIPT","PREDECESSOR::B03C","RECEIPT::B03C","REVIEW-SLOT::B03C::RECEIPT_REVIEWER","REVIEW-SLOT::B03C::SOURCE_REVIEWER","RUNTIME::B03C"],"gate_state":"BLOCKED","identity":"ORIGIN_REPAIR::B03C::sha256:e27e4fd37d6dbf04159477a9fdb1ffa6f5d2838eb109085f1ccde09980a8ae24","receipt_state":"BLOCKED","runtime_state":"NOT_ATTESTED","work_state":"NOT_STARTED"},{"blocking_reasons":["ANCHOR::B04C","PREDECESSOR::B04C","RECEIPT::B04C","REVIEW-SLOT::B04C::RECEIPT_REVIEWER","REVIEW-SLOT::B04C::SOURCE_REVIEWER","RUNTIME::B04C"],"gate_state":"BLOCKED","identity":"ORIGIN_REPAIR::B04C::sha256:f9f42e48fc0a642b16a2512854a39acd595e9f45070db4580db487eaaca274c2","receipt_state":"BLOCKED","runtime_state":"NOT_ATTESTED","work_state":"NOT_STARTED"},{"blocking_reasons":["ANCHOR::B05C","B05-AUTHORIZATION","B05-CREDENTIAL-ROTATION","B05-PHYSICAL-ISOLATION-SOAK","PREDECESSOR::B05C","RECEIPT::B05C","REVIEW-SLOT::B05C::RECEIPT_REVIEWER","REVIEW-SLOT::B05C::SOURCE_REVIEWER","RUNTIME::B05C"],"gate_state":"BLOCKED","identity":"ORIGIN_REPAIR::B05C::sha256:d05dd3facf362c71aec3a66e344962a0bf7a76cf0ee8c63fe14fb05f717c6c22","receipt_state":"BLOCKED","runtime_state":"NOT_ATTESTED","work_state":"NOT_STARTED"},{"blocking_reasons":["ANCHOR::B06R","PREDECESSOR::B06R","RECEIPT::B06R","REVIEW-SLOT::B06R::RECEIPT_REVIEWER","REVIEW-SLOT::B06R::SOURCE_REVIEWER","RUNTIME::B06R"],"gate_state":"BLOCKED","identity":"ORIGIN_REPAIR::B06R::sha256:b851e656d1e01bd2ba1705d47c93ff4551f4ffd2842939b807ab486f76fcde2d","receipt_state":"BLOCKED","runtime_state":"NOT_ATTESTED","work_state":"NOT_STARTED"},{"blocking_reasons":["ANCHOR::B07","PREDECESSOR::B07","RECEIPT::B07","REVIEW-SLOT::B07::RECEIPT_REVIEWER","REVIEW-SLOT::B07::SOURCE_REVIEWER","RUNTIME::B07"],"gate_state":"BLOCKED","identity":"ORIGIN_REPAIR::B07::sha256:2d5ebad6dc68cf908d1a26f161f4d5870fe585c4cbca8a8b7e9d998cd8150bef","receipt_state":"BLOCKED","runtime_state":"NOT_ATTESTED","work_state":"NOT_STARTED"},{"blocking_reasons":["ANCHOR::XC01","PREDECESSOR::XC01","RECEIPT::XC01","REVIEW-SLOT::XC01::RECEIPT_REVIEWER","REVIEW-SLOT::XC01::SOURCE_REVIEWER","RUNTIME::XC01","XC01-OWNER-RECEIPTS"],"gate_state":"BLOCKED","identity":"ESTATE_CROSS_REPO::XC01::sha256:70a8eb8cf39df88c508f2469a936ba1e926ed6bc84d608c5ff5b9dc913db3ca8","receipt_state":"BLOCKED","runtime_state":"NOT_ATTESTED","work_state":"NOT_STARTED"},{"blocking_reasons":["ANCHOR::B08","PREDECESSOR::B08","RECEIPT::B08","REVIEW-SLOT::B08::RECEIPT_REVIEWER","REVIEW-SLOT::B08::SOURCE_REVIEWER","RUNTIME::B08"],"gate_state":"BLOCKED","identity":"ORIGIN_REPAIR::B08::sha256:4bf3e75b3c4de3c0f997f2191551afd5dbd39b452658eff5e3f9e67416b9f83f","receipt_state":"BLOCKED","runtime_state":"NOT_ATTESTED","work_state":"NOT_STARTED"},{"blocking_reasons":["ANCHOR::B09","B09-CONFORMANCE-DR","PREDECESSOR::B09","RECEIPT::B09","REVIEW-SLOT::B09::RECEIPT_REVIEWER","REVIEW-SLOT::B09::SOURCE_REVIEWER","RUNTIME::B09"],"gate_state":"BLOCKED","identity":"ORIGIN_REPAIR::B09::sha256:00773cb7d61c85d047cbd2c828c9f0324476d6fb0701b7019541ccc24bae3407","receipt_state":"BLOCKED","runtime_state":"NOT_ATTESTED","work_state":"NOT_STARTED"},{"blocking_reasons":["ANCHOR::B10","B10-CREDENTIAL-GATE","B10-FROZEN-SUBJECT","B10-TWO-AUDITS","PREDECESSOR::B10","RECEIPT::B10","REVIEW-SLOT::B10::B10_ADJUDICATOR","REVIEW-SLOT::B10::B10_RUNTIME_SIDE_EFFECT_AUDITOR","REVIEW-SLOT::B10::B10_SEMANTIC_SOURCE_AUDITOR","REVIEW-SLOT::B10::RECEIPT_REVIEWER","REVIEW-SLOT::B10::SOURCE_REVIEWER","RUNTIME::B10"],"gate_state":"BLOCKED","identity":"ORIGIN_REPAIR::B10::sha256:f1d75c13f8d1cd0622738fc1d9e6f30cbc73aed0828652df1a71817f7fe06a25","receipt_state":"BLOCKED","runtime_state":"NOT_ATTESTED","work_state":"NOT_STARTED"},{"blocking_reasons":["ANCHOR::BN","BN-FRESH-AGGREGATE","PREDECESSOR::BN","RECEIPT::BN","REVIEW-SLOT::BN::RECEIPT_REVIEWER","REVIEW-SLOT::BN::SOURCE_REVIEWER","RUNTIME::BN"],"gate_state":"BLOCKED","identity":"ESTATE_CLOSURE::BN::sha256:80dd0762c222cb661692896003ace482602cd028860d630d58da71a925cb79e3","receipt_state":"BLOCKED","runtime_state":"NOT_ATTESTED","work_state":"NOT_STARTED"}],"next_gate":"Complete C0 owner authentication and exact-head independent review; continue B00R G2 source validation without runtime or venue mutation.","open_blockers":[{"blocker_id":"ANCHOR::B00R_G2","owner_identity":"ORIGIN_REPAIR::B00R_G2::sha256:71b011d46c6a7ebd092bda6d2d303572c9a44508bd126ff9a50e2e5bad40eaf5","provenance_kind":"PATH_LAW","provenance_ref":"B00R_RECEIPT_ANCHOR_G2","reason":"required protected anchor is not published","severity":"P0","status":"OPEN"},{"blocker_id":"ANCHOR::B01C","owner_identity":"ORIGIN_REPAIR::B01C::sha256:7d6e36d32db8e3eee19aa6fd446bdc48644f70916ef09d939f113f19c5a6db5e","provenance_kind":"PATH_LAW","provenance_ref":"B01C_RECEIPT_ANCHOR","reason":"required protected anchor is not published","severity":"P0","status":"OPEN"},{"blocker_id":"ANCHOR::B02C","owner_identity":"ORIGIN_REPAIR::B02C::sha256:c7362e128a8d249ad1075769a314baacd5d7993a62e2b374ed22ea8eb7b3e5bf","provenance_kind":"PATH_LAW","provenance_ref":"B02C_RECEIPT_ANCHOR","reason":"required protected anchor is not published","severity":"P0","status":"OPEN"},{"blocker_id":"ANCHOR::B03C","owner_identity":"ORIGIN_REPAIR::B03C::sha256:e27e4fd37d6dbf04159477a9fdb1ffa6f5d2838eb109085f1ccde09980a8ae24","provenance_kind":"PATH_LAW","provenance_ref":"B03C_RECEIPT_ANCHOR","reason":"required protected anchor is not published","severity":"P0","status":"OPEN"},{"blocker_id":"ANCHOR::B04C","owner_identity":"ORIGIN_REPAIR::B04C::sha256:f9f42e48fc0a642b16a2512854a39acd595e9f45070db4580db487eaaca274c2","provenance_kind":"PATH_LAW","provenance_ref":"B04C_RECEIPT_ANCHOR","reason":"required protected anchor is not published","severity":"P0","status":"OPEN"},{"blocker_id":"ANCHOR::B05C","owner_identity":"ORIGIN_REPAIR::B05C::sha256:d05dd3facf362c71aec3a66e344962a0bf7a76cf0ee8c63fe14fb05f717c6c22","provenance_kind":"PATH_LAW","provenance_ref":"B05C_RECEIPT_ANCHOR","reason":"required protected anchor is not published","severity":"P0","status":"OPEN"},{"blocker_id":"ANCHOR::B06R","owner_identity":"ORIGIN_REPAIR::B06R::sha256:b851e656d1e01bd2ba1705d47c93ff4551f4ffd2842939b807ab486f76fcde2d","provenance_kind":"PATH_LAW","provenance_ref":"B06R_RECEIPT_ANCHOR","reason":"required protected anchor is not published","severity":"P0","status":"OPEN"},{"blocker_id":"ANCHOR::B07","owner_identity":"ORIGIN_REPAIR::B07::sha256:2d5ebad6dc68cf908d1a26f161f4d5870fe585c4cbca8a8b7e9d998cd8150bef","provenance_kind":"PATH_LAW","provenance_ref":"B07_RECEIPT_ANCHOR","reason":"required protected anchor is not published","severity":"P0","status":"OPEN"},{"blocker_id":"ANCHOR::B08","owner_identity":"ORIGIN_REPAIR::B08::sha256:4bf3e75b3c4de3c0f997f2191551afd5dbd39b452658eff5e3f9e67416b9f83f","provenance_kind":"PATH_LAW","provenance_ref":"B08_RECEIPT_ANCHOR","reason":"required protected anchor is not published","severity":"P0","status":"OPEN"},{"blocker_id":"ANCHOR::B09","owner_identity":"ORIGIN_REPAIR::B09::sha256:00773cb7d61c85d047cbd2c828c9f0324476d6fb0701b7019541ccc24bae3407","provenance_kind":"PATH_LAW","provenance_ref":"B09_RECEIPT_ANCHOR","reason":"required protected anchor is not published","severity":"P0","status":"OPEN"},{"blocker_id":"ANCHOR::B10","owner_identity":"ORIGIN_REPAIR::B10::sha256:f1d75c13f8d1cd0622738fc1d9e6f30cbc73aed0828652df1a71817f7fe06a25","provenance